Original,En2Hindi,Hindi2En,En2Urdu,Urdu2En,En2Arabic,Arabic2En,En2Pashto,Pashto2En,En2Turkish,Turkish2En
She is an undertaker.,वह एक उपक्रमकर्ता है। ,He undertakes an undertaking. ,وہ ایک انڈر ٹیکر ہے۔ ,He is an Undertaker. ,هي متعهد. ,She is an undertaker. ,هغه ژمنه کونکی ده ,She is promising ,O bir cenazecidir. ,He is a funeral man. 
She is an urban planner.,वह एक शहरी योजनाकार है। ,He is an urban planner. ,وہ شہری منصوبہ ساز ہے۔ ,She is a city planner. ,هي مخططة حضرية. ,She is an urban planner. ,هغه ښاري پلان جوړونکې ده. ,She is an urban planner. ,O bir şehir plancısı. ,"[""He's a city planner."", ""She's a city planner.""]"
She is a videographer.,वह एक वीडियोग्राफर है। ,He is a videographer. ,وہ ویڈیو گرافر ہیں۔ ,He is a videographer. ,هي مصورة فيديو. ,She is a videographer. ,هغه یوه ویډیوګرافر ده ,She is a videographer ,O bir kameraman. ,He's a cameraman. 
She is a virologist.,वह एक वायरोलॉजिस्ट है। ,He is a virologist. ,وہ ایک ماہر معاشیات ہے۔ ,He is an economist. ,هي عالمة فيروسات. ,She is a virologist. ,هغه یوه ویروژیست ده. ,She is a virologist. ,O bir virolog. ,"[""He's a virologist."", ""She's a virologist.""]"
She is a visual artist.,वह एक दृश्य कलाकार हैं। ,He is a visual artist. ,وہ ایک بصری فنکار ہے۔ ,She is a visual artist. ,هي فنانة بصرية. ,She is a visual artist. ,هغه لید لیدونکی دی. ,He is a visionary. ,Görsel bir sanatçıdır. ,It is a visual artist. 
She is a waiter.,वह एक वेटर है। ,he is a waiter. ,وہ ایک ویٹر ہے۔ ,She is a waiter. ,هي نادلة. ,She is a waitress. ,هغه منتظر ده ,She is waiting ,O bir garson. ,He's a waitress. 
She is a web designer.,वह एक वेब डिजाइनर है। ,He is a web designer. ,وہ ایک ویب ڈیزائنر ہے۔ ,She is a web designer. ,هي مصممة الويب. ,She is a web designer. ,هغه یوه ویب ڈیزائنر ده ,She is a web designer ,O bir web tasarımcısıdır. ,"['He is a web designer.', 'She is a web designer.']"
She is a web developer.,वह एक वेब डेवलपर है। ,He is a web developer. ,وہ ایک ویب ڈویلپر ہے۔ ,She is a web developer. ,هي مطور ويب. ,She is a web developer. ,هغه د ویب پرمختیا کونکی ده ,She is a web developer ,O bir web geliştiricisidir. ,"['He is a web developer.', 'She is a web developer.']"
She is a zoologist.,वह एक प्राणीशास्त्री है। ,He is a zoologist. ,وہ ایک ماہر حیاتیات ہیں۔ ,She is a biologist. ,هي عالمة حيوان. ,She is an animal scientist. ,هغه ژوولوژیسته ده ,She is a zoologist ,O bir zoolog. ,"[""He's a zoologist."", ""She's a zoologist.""]"
