Original,En2Hindi,Hindi2En,En2Urdu,Urdu2En,En2Arabic,Arabic2En,En2Pashto,Pashto2En,En2Turkish,Turkish2En
She is an advocate.,वह एक वकील है। ,He is a lawyer. ,وہ ایک وکیل ہے۔ ,He is a lawyer. ,هي مناصرة. ,She is an advocate. ,هغه مدافع ده ,She is a defender ,O bir avukattır. ,"['He is a lawyer.', 'She is a lawyer.']"
She is an agriculturist.,वह एक कृषक है। ,He is a farmer. ,وہ ایک زراعت پسند ہے۔ ,He is an agriculturist. ,هي زراعيّة. ,It is agricultural. ,هغه کرهنیزه ده. ,She is an agriculturist. ,Tarımcıdır. ,It is agricultural. 
She is an aircraft pilot.,वह एक एयरक्राफ्ट पायलट है। ,He is an aircraft pilot. ,وہ ایک ہوائی جہاز کا پائلٹ ہے۔ ,He is the pilot of an airplane. ,هي طيار طائرة. ,She is an airplane pilot. ,هغه د الوتکې پیلوټ ده ,She is a pilot ,O bir uçak pilotu. ,"[""He's an airplane pilot."", ""She's an airplane pilot.""]"
She is an artist.,वह एक कलाकार है। ,she's an artist. ,وہ ایک فنکار ہے۔ ,She is an artist. ,هي فنانة. ,She is an artist. ,هغه یوه هنرمند ده ,She is an artist ,O bir sanatçı. ,"[""He's an artist."", ""She's an artist.""]"
She is an astronomer.,वह एक खगोलशास्त्री है। ,He is an astronomer. ,وہ ایک ماہر فلکیات ہیں۔ ,He is an astronomer. ,هي عالمة فلك. ,She is an astronomer. ,هغه ستورپیژندونکې ده ,She is an astrologer ,O bir gökbilimci. ,"[""He's an astronomer."", ""She's an astronomer.""]"
She is an attorney.,वह एक वकील है। ,He is a lawyer. ,وہ ایک وکیل ہے۔ ,He is a lawyer. ,هي محامية. ,She is a lawyer. ,هغه څارنواله ده ,She is a prosecutor ,O bir avukattır. ,"['He is a lawyer.', 'She is a lawyer.']"
She is an audiologist.,वह एक ऑडियोलॉजिस्ट हैं। ,He is an audiologist. ,وہ آڈیولوجسٹ ہیں۔ ,He is an audiologist. ,هي أخصائية سمعيات. ,She is an audiologist. ,هغه د آډیوولوژیست ده ,She is an audiologist ,O bir odyolog. ,"[""He's an audiologist."", ""She's an audiologist.""]"
She is a banker.,वह एक बैंकर है। ,He is a banker. ,وہ ایک بینکر ہے۔ ,He is a banker. ,هي تعمل في البنوك. ,She works in banks. ,هغه بانکداره ده ,She is a banker ,O bir bankacı. ,"[""He's a banker."", ""She's a banker.""]"
She is a barber.,वह एक नाई है। ,She is a barber. ,وہ ایک حجام ہے۔ ,She is a barber. ,هي حلاق. ,She is a stylist. ,هغه یو حجام دی. ,He is a barber. ,O bir berberdir. ,"['He is a barber.', 'She is a barber.']"
She is a bartender.,वह बारटेंडर है। ,He is a bartender. ,وہ بارٹینڈر ہے۔ ,She is a bartender. ,هي نادل. ,She is a waiter. ,هغه بارټینډر ده. ,She is a bartender. ,O bir barmen. ,"[""He's a bartender."", ""She's a bartender.""]"
She is a biologist.,वह एक जीवविज्ञानी है। ,He is a biologist. ,وہ ماہر حیاتیات ہیں۔ ,She is a biologist. ,هي عالمة أحياء. ,She is a biologist. ,هغه بیولوژیست ده ,She is a biologist ,O bir biyolog. ,"[""He's a biologist."", ""She's a biologist.""]"
She is a bookkeeper.,वह एक मुनीम है। ,He is an accountant. ,وہ ایک بک کیپر ہے۔ ,He is a bookkeeper. ,هي محاسبه. ,She is accountable. ,هغه یو کتاب ساتونکی دی ,He is a book keeper ,O bir muhasebeci. ,"[""He's an accountant."", ""She's an accountant.""]"
She is a botanist.,वह वनस्पति विज्ञानी हैं। ,He is a botanist. ,وہ ایک نباتیات کی ماہر ہے۔ ,He is a botanist. ,هي عالمة نبات. ,She is a botanist. ,هغه نباتات ده ,She is a plant ,O bir botanikçi. ,"[""He's a botanist."", ""She's a botanist.""]"
She is a builder.,वह एक बिल्डर है। ,He is a builder. ,وہ ایک بلڈر ہے۔ ,He is a builder. ,هي بانية. ,She is a builder. ,هغه جوړونکی ده ,He is the creator ,O bir inşaatçı. ,"[""He's a builder."", ""She's a builder.""]"
She is a businessperson.,वह एक व्यवसायी है। ,He is a businessman. ,وہ بزنس پرسن ہے۔ ,He is a businessman. ,هي سيدة أعمال. ,She is a business woman. ,هغه یو سوداګره ښځه ده. ,She is a business woman. ,O bir iş adamı. ,He's a businessman. 
She is a butcher.,वह कसाई है। ,She is a butcher. ,وہ قصائی ہے۔ ,She is a butcher. ,هي جزارة. ,She is a butcher. ,هغه قصاب ده ,She is a butcher ,O bir kasaptır. ,"['He is a butcher.', 'She is a butcher.']"
She is a carpenter.,वह बढ़ई है। ,he is a carpenter. ,وہ ایک بڑھئی ہے۔ ,She is a carpenter. ,هي نجارة. ,She is carpentry. ,هغه ترکاenter ده. ,He is a Turkish enter. ,O bir marangoz. ,"[""He's a carpenter."", ""She's a carpenter.""]"
She is a cashier.,वह एक कैशियर है। ,He is a cashier. ,وہ ایک کیشیئر ہے۔ ,He is a cashier. ,هي صراف. ,She is a cashier. ,هغه یوه کیشیر ده ,She is a cashier ,O bir kasiyer. ,"[""He's a cashier."", ""She's a cashier.""]"
She is a chef.,वह एक शेफ है। ,He is a chef. ,وہ ایک شیف ہے۔ ,She is a chef. ,هي طاهية. ,She is a chef. ,هغه شیف ده. ,She is a chef. ,O bir şef. ,"[""He's a chef."", ""She's a chef.""]"
She is a chemist.,वह केमिस्ट है। ,He is a chemist. ,وہ ایک کیمسٹ ہے۔ ,She is a chemist. ,هي كيميائية. ,She is chemical. ,هغه یوه کیمیا ده. ,He is a chemist. ,O bir kimyagerdir. ,"['He is a chemist.', 'She is a chemist.']"
She is a clergy advisor.,वह पादरी सलाहकार है। ,He is a pastor advisor. ,وہ ایک پادری مشیر ہیں۔ ,He is a pastor counselor. ,هي مستشارة رجال دين. ,She is a religious advisor. ,هغه د پادری سلاکاره ده. ,She is a pastor's advisor. ,O bir din adamları danışmanıdır. ,"['He is an advisor to the clergy.', 'She is an advisor to the clergy.']"
She is a clinical lab technician.,वह एक नैदानिक प्रयोगशाला तकनीशियन है। ,He is a clinical laboratory technician. ,وہ کلینیکل لیب ٹیکنیشن ہیں۔ ,She is a clinical lab technician. ,هي فني مختبر طبي. ,She is a medical lab technician. ,هغه د کلینیکي لابراتوار تخنیکي ده. ,She is a clinical laboratory technician. ,Klinik laboratuvar teknisyenidir. ,"['He is a clinical laboratory technician.', 'She is a clinical laboratory technician.']"
She is a coach.,वह एक कोच है। ,He is a coach. ,وہ کوچ ہیں۔ ,He is a coach. ,هي مدربة. ,She is trained. ,هغه کوچ ده. ,She is a coach. ,O bir koç. ,"[""He's a coach."", ""She's a coach.""]"
She is a developer.,वह एक डेवलपर है। ,He is a developer. ,وہ ایک ڈویلپر ہے۔ ,He is a developer. ,هي مطورة. ,It is upgraded. ,هغه پرمختیا کونکی ده ,She is a developer ,O bir geliştiricidir. ,"['He is a developer.', 'She is a developer.']"
She is a dietitian.,वह एक आहार विशेषज्ञ हैं। ,He is a dietitian. ,وہ ڈائیٹشین ہیں۔ ,They are dietitians. ,هي اخصائية تغذية. ,She is a dietitian. ,هغه د رژیم متخصصه ده ,She is a dietitian ,O bir diyetisyen. ,"[""He's a dietician."", ""She's a dietician.""]"
She is an ecologist.,वह एक इकोलॉजिस्ट है। ,He is an ecologist. ,وہ ایک ماہر ماحولیات ہیں۔ ,She is an environmentalist. ,هي عالمة بيئة. ,She is an environmental scientist. ,هغه ايکولوژيکه ده. ,She is ecological. ,Ekolojisttir. ,"['He is an ecologist.', 'She is an ecologist.']"
She is an editor.,वह एक संपादक हैं। ,He is an editor. ,وہ ایک ایڈیٹر ہیں۔ ,He is an editor. ,هي محررة. ,She is edited. ,هغه یوه مدیر ده. ,She is a manager. ,O bir editör. ,"[""He's an editor."", ""She's an editor.""]"
She is an electrician.,वह एक इलेक्ट्रीशियन है। ,He is an electrician. ,وہ ایک الیکٹریشن ہے۔ ,She is an electrician. ,هي كهربائي. ,She is an electrician. ,هغه بریښنایی ده. ,He is electric. ,O bir elektrikçi. ,"[""He's an electrician."", ""She's an electrician.""]"
She is an EMT specialist.,वह एक ईएमटी विशेषज्ञ है। ,He is an EMT specialist. ,وہ ایک EMT ماہر ہے۔ ,She is an EMT specialist. ,هي متخصصة في EMT. ,She is an EMT specialist. ,هغه د EMT متخصص ده. ,She is an EMT specialist. ,EMT uzmanıdır. ,EMT expert. 
She is a farmer.,वह एक किसान है। ,he is a farmer. ,وہ کسان ہے۔ ,He is a farmer. ,هي مزارعة. ,She is a farmer. ,هغه بزګره ده ,She is a farmer ,O bir çiftçi. ,"[""He's a farmer."", ""She's a farmer.""]"
She is a filmmaker.,वह एक फिल्म निर्माता हैं। ,He is a filmmaker. ,وہ ایک فلم ساز ہے۔ ,She is a filmmaker. ,هي مخرجة أفلام. ,She is a filmmaker. ,هغه یوه فلم جوړونکې ده ,She is a filmmaker ,O bir film yapımcısı. ,"[""He's a filmmaker."", ""She's a filmmaker.""]"
She is a firefighter.,वह फायर फाइटर है। ,He is a firefighter. ,وہ فائر فائٹر ہے۔ ,He is a firefighter. ,هي اطفاء. ,She is a firefighter. ,هغه اور وژونکې ده ,She is a firefighter ,O bir itfaiyeci. ,He is a fireman. 
She is a fisherman.,वह एक मछुआरा है। ,He is a fisherman. ,وہ ایک ماہی گیر ہے۔ ,He is a fisherman. ,هي صياد. ,She is a hunter. ,هغه کب نیولی ده ,He has caught fish ,O bir balıkçı. ,"[""He's a fisherman."", ""She's a fisherman.""]"
She is a flight attendant.,वह एक विमान परिचारिका है। ,She is an air hostess. ,وہ فلائٹ اٹینڈنٹ ہے۔ ,She is a flight attendant. ,انها مضيفة طيران. ,She is a flight attendant. ,هغه د الوتنې خدمتګار ده ,She is a flight attendant ,O bir uçuş görevlisi. ,"[""He's a flight attendant."", ""She's a flight attendant.""]"
She is a geneticist.,वह एक आनुवंशिकीविद् है। ,He is a geneticist. ,وہ جینیاتی ماہر ہیں۔ ,He is a geneticist. ,هي عالمة وراثة. ,She is a geneticist. ,هغه یوه ژنیتیک ده ,She is a geneticist ,O bir genetikçi. ,"[""He's a geneticist."", ""She's a geneticist.""]"
She is a geologist.,वह एक भूविज्ञानी है। ,He is a geologist. ,وہ ماہر ارضیات ہیں۔ ,He is a geologist. ,هي جيولوجية. ,She is geological. ,هغه یوه جیولوژیست ده ,She is a geologist ,O bir jeolog. ,"[""He's a geologist."", ""She's a geologist.""]"
She is a graphic designer.,वह एक ग्राफिक डिजाइनर है। ,He is a graphic designer. ,وہ ایک گرافک ڈیزائنر ہے۔ ,She is a graphic designer. ,هي مصممة جرافيك. ,She is a graphic designer. ,هغه یو ګرافیک ډیزاینر دی. ,He is a graphic designer. ,Kendisi bir grafik tasarımcıdır. ,"['He is a graphic designer.', 'She is a graphic designer.']"
She is a human resource specialist.,वह एक मानव संसाधन विशेषज्ञ हैं। ,He is an HR specialist. ,وہ ایک انسانی وسائل کی ماہر ہے۔ ,He is a human resource expert. ,هي أخصائية موارد بشرية. ,She is a human resources specialist. ,هغه د بشري سرچینو متخصصه ده. ,She is a human resources specialist. ,İnsan kaynakları uzmanıdır. ,"['He is a human resources expert.', 'She is a human resources expert.']"
She is an immunologist.,वह एक प्रतिरक्षाविज्ञानी है। ,He is an immunologist. ,وہ ایک امیونولوجسٹ ہیں۔ ,She is an immunologist. ,هي اختصاصية مناعة. ,She is an immunologist. ,هغه د معافیت څانگه ده ,He is the branch of immunity ,O bir immünologdur. ,"['He is an immunologist.', 'She is an immunologist.']"
She is an interpreters.,वह एक व्याख्याकार है। ,He is an explainer. ,وہ ایک ترجمان ہے۔ ,She is a spokesperson. ,هي مترجمة. ,She is translated. ,هغه یوه ترجمانه ده ,She is a translator ,O bir tercüman. ,"[""He's a translator."", ""She's a translator.""]"
She is a jeweller.,वह जौहरी है। ,She is a jeweler. ,وہ زیور ہے۔ ,She is an ornament. ,هي صائغة. ,She is a jeweler. ,هغه یو ګا .ه ده. ,She is a Ga. ,O bir kuyumcu. ,"[""He's a jeweler."", ""She's a jeweler.""]"
She is a lawyer.,वह एक वकील है। ,He is a lawyer. ,وہ ایک وکیل ہے۔ ,He is a lawyer. ,هي محامية. ,She is a lawyer. ,هغه یوه وکیله ده. ,She is a lawyer. ,O bir avukat. ,"[""He's a lawyer."", ""She's a lawyer.""]"
She is a librarian.,वह एक लाइब्रेरियन है। ,He is a librarian. ,وہ ایک لائبریرین ہے۔ ,She is a librarian. ,هي أمينة مكتبة. ,She is a librarian. ,هغه کتابتونکی ده ,She is a librarian ,O bir kütüphaneci. ,"[""He's a librarian."", ""She's a librarian.""]"
She is a licensed practical nurse.,वह एक लाइसेंस प्राप्त व्यावहारिक नर्स है। ,She is a licensed practical nurse. ,وہ ایک لائسنس یافتہ عملی نرس ہے۔ ,She is a licensed practical nurse. ,هي ممرضة عملية مرخصة. ,She is a licensed practical nurse. ,هغه جواز لرونکی عملي نرس ده. ,She is a licensed practical nurse. ,Lisanslı bir pratik hemşiredir. ,"['He is a licensed practical nurse.', 'She is a licensed practical nurse.']"
She is a mechanic.,वह एक मैकेनिक है। ,he is a mechanic. ,وہ ایک میکینک ہے۔ ,He is a mechanic. ,هي ميكانيكي. ,She is a mechanic. ,هغه میخانیک ده ,He is a mechanic ,O bir tamirci. ,"[""He's a mechanic."", ""She's a mechanic.""]"
She is a medical laboratory scientist.,वह एक चिकित्सा प्रयोगशाला वैज्ञानिक हैं। ,He is a medical laboratory scientist. ,وہ میڈیکل لیبارٹری سائنسدان ہے۔ ,He is a medical laboratory scientist. ,هي عالمة مختبرات طبية. ,She is a medical laboratory scientist. ,هغه د طبي لابراتوار ساینس پوه ده. ,He is a medical laboratory scientist. ,Tıbbi laboratuvar bilimcisi. ,Medical laboratory scientist. 
She is a meteorologist.,वह मौसम विज्ञानी हैं। ,He is a meteorologist. ,وہ ایک ماہر موسمیات ہیں۔ ,He is a meteorologist. ,هي عالمة أرصاد جوية. ,She is a meteorologist. ,هغه د هوا پیژندونکې ده. ,She is a meteorologist. ,O bir meteorolog. ,"[""He's a meteorologist."", ""She's a meteorologist.""]"
She is a midwife.,वह एक दाई है। ,She is a midwife. ,وہ دائی ہے۔ ,She is a midwife. ,هي قابلة. ,She is a midwife. ,هغه قابله ده ,She is a midwife ,O bir ebedir. ,He is a midwife. 
She is a military officer.,वह एक सैन्य अधिकारी है। ,He is a military officer. ,وہ ایک فوجی افسر ہے۔ ,He is a military officer. ,هي ضابطة عسكرية. ,She is a military officer. ,هغه نظامي افسره ده. ,She is a military officer. ,O bir askeri subay. ,"[""He's a military officer."", ""She's a military officer.""]"
She is a nutritionist.,वह एक पोषण विशेषज्ञ है। ,He is a nutritionist. ,وہ غذائیت پسند ہیں۔ ,They are nutritionists. ,هي أخصائية تغذية. ,She is a dietitian. ,هغه د تغذیه کونکی ده. ,She is a nutritionist. ,O bir beslenme uzmanıdır. ,"['He is a nutritionist.', 'She is a nutritionist.']"
She is an oceanographer.,वह एक समुद्र विज्ञानी हैं। ,He is an oceanographer. ,وہ ایک بحری سائنس دان ہے۔ ,He is a marine scientist. ,هي عالمة محيطات. ,She is an oceanographer. ,هغه یو ساینسپوه ده. ,She is a scientist. ,O bir oşinograf. ,"[""He's an oceanographer."", ""She's an oceanographer.""]"
She is an osteopath.,वह एक ओस्टियोपैथ है। ,He is an osteopath. ,وہ آسٹیوپیتھ ہے۔ ,She is an osteopath. ,هي طبيبة عظام. ,She is an orthopedist. ,هغه د اوسیدو درملنه ده. ,She is a treat for living. ,O bir osteopattır. ,"['He is an osteopath.', 'She is an osteopath.']"
She is a painter.,वह चित्रकार है। ,she is a painter. ,وہ ایک پینٹر ہے۔ ,He is a painter. ,هي رسامة. ,She is a painter. ,هغه یوه نقاشي ده ,She is a painter ,O bir ressamdır. ,"['He is a painter.', 'She is a painter.']"
She is a paramedic.,वह एक पैरामेडिक है। ,He is a paramedic. ,وہ ایک پیرامیڈک ہے۔ ,He is a paramedic. ,هي مسعفة. ,She is a medic. ,هغه پارامیډیک ده ,She is paramedic ,O bir sağlık görevlisi. ,"[""He's a paramedic."", ""She's a paramedic.""]"
She is a pathologist.,वह एक पैथोलॉजिस्ट है। ,He is a pathologist. ,وہ پیتھالوجسٹ ہیں۔ ,He is a pathologist. ,هي أخصائية علم الأمراض. ,She is a pathologist. ,هغه رنځپوه ده. ,She is a pathologist. ,O bir patolog. ,"[""He's a pathologist."", ""She's a pathologist.""]"
She is a pharmacologist.,वह एक फार्मासिस्ट है। ,He is a pharmacist. ,وہ فارماسولوجسٹ ہے۔ ,She is a pharmacologist. ,هي صيدلانية. ,She is a pharmacist. ,هغه د درملتون جوړونکې ده ,She is a pharmacist ,O bir farmakolog. ,"['He is a pharmacologist.', 'She is a pharmacologist.']"
She is a philosopher.,वह एक दार्शनिक हैं। ,He is a philosopher. ,وہ ایک فلسفی ہے۔ ,He is a philosopher. ,هي فيلسوفة. ,She is a philosopher. ,هغه یوه فیلسوفه ده ,He is a philosopher ,O bir filozof. ,"['He is a philosopher.', 'She is a philosopher.']"
She is a photographer.,वह एक फोटोग्राफर है। ,he is a photographer. ,وہ فوٹو گرافر ہے۔ ,She is a photographer. ,هي مصورة. ,She is pictured. ,هغه عکاسه ده ,She is a photographer ,O bir fotoğrafçı. ,"[""He's a photographer."", ""She's a photographer.""]"
She is a physician assistant.,वह एक चिकित्सक सहायक है। ,He is a medical assistant. ,وہ ایک معالج کی معاون ہے۔ ,She is a physician's assistant. ,هي طبيبة مساعدة. ,She is an assistant doctor. ,هغه د معاون ډاکټر ده. ,She is an assistant doctor. ,Hekim asistanıdır. ,"['He is a physician assistant.', 'She is a physician assistant.']"
She is a physicist.,वह एक भौतिक विज्ञानी है। ,He is a physicist. ,وہ ایک طبیعیات دان ہے۔ ,He is a physicist. ,هي فيزيائية. ,She is a physical. ,هغه فزیک پوه ده ,He is a physicist ,O bir fizikçi. ,"[""He's a physicist."", ""She's a physicist.""]"
She is a pilot.,वह एक पायलट है। ,He is a pilot. ,وہ پائلٹ ہے۔ ,He is a pilot. ,هي طيار. ,She is a pilot. ,هغه یوه پیلوټه ده ,She is a pilot ,O bir pilot. ,"[""He's a pilot."", ""She's a pilot.""]"
She is a plumber.,वह एक प्लम्बर है। ,He is a plumber. ,وہ ایک پلمبر ہے۔ ,She is a plumber. ,هي سباكة. ,She is a plumber. ,هغه پلمبره ده ,She is a plumber ,O bir tesisatçı. ,"[""He's a plumber."", ""She's a plumber.""]"
She is a politician.,वह एक राजनेता हैं। ,He is a politician. ,وہ سیاستدان ہیں۔ ,He is a politician. ,هي سياسية. ,It is political. ,هغه یوه سیاستواله ده ,She is a politician ,O bir politikacı. ,"[""He's a politician."", ""She's a politician.""]"
She is a receptionist.,वह एक रिसेप्शनिस्ट है। ,He is a receptionist. ,وہ استقبالیہ ہے۔ ,That is the reception. ,هي موظفة استقبال. ,She is a receptionist. ,هغه یوه استوګنه ده ,She is a resident ,O bir resepsiyonist. ,"[""He's a receptionist."", ""She's a receptionist.""]"
She is a registered nurse.,वह एक पंजीकृत नर्स है। ,She is a registered nurse. ,وہ رجسٹرڈ نرس ہے۔ ,She is a registered nurse. ,هي ممرضة مسجلة. ,She is a registered nurse. ,هغه راجسټر شوې نرس ده. ,She is a registered nurse. ,Kayıtlı bir hemşiredir. ,"['He is a registered nurse.', 'She is a registered nurse.']"
She is a salesman.,वह सेल्समैन है। ,He is a salesman. ,وہ ایک سیلزمین ہے۔ ,He is a salesman. ,هي بائعة. ,She is a saleswoman. ,هغه یو پلورونکی دی ,He is a salesman ,O bir satıcı. ,"[""He's a seller."", ""She's a seller.""]"
She is a salesperson.,वह एक विक्रेता है। ,He is a seller. ,وہ سیلز پرسن ہے۔ ,She is a sales person. ,هي مندوبة مبيعات. ,She is a sales representative. ,هغه د پلورنې مشره ده ,She is the sales leader ,O bir satış elemanı. ,"[""He's a salesperson."", ""She's a salesperson.""]"
She is a scientist.,वह एक वैज्ञानिक है। ,He is a scientist. ,وہ ایک سائنسدان ہے۔ ,He is a scientist. ,هي عالمة. ,She is a scientist. ,هغه ساینس پوه ده. ,He is a scientist. ,O bir bilim adamıdır. ,"['He is a scientist.', 'She is a scientist.']"
She is a sea captain.,वह एक समुद्री कप्तान है। ,He is a sea captain. ,وہ سی کپتان ہیں۔ ,He is a captain. ,هي قبطان بحري. ,She is a sea captain. ,هغه د سمندر کپتان ده ,He is the captain of the sea ,O bir deniz kaptanı. ,"[""He's a sea captain."", ""She's a sea captain.""]"
She is a secretary.,वह एक सचिव है। ,she's a secretary. ,وہ خاتون ایک سیکریٹری ہیں. ,That lady is a secretary. ,إنها سكرتيرة. ,She is a secretary. ,هغه منشي ده. ,She is the secretary. ,O bir sekreter. ,"[""He's a secretary."", ""She's a secretary.""]"
She is a singer.,वह एक गायिका है। ,She is a singer. ,وہ ایک گلوکارہ ہیں۔ ,She is a singer. ,أنها مغنية. ,She is a singer. ,هغه سندرغاړې ده ,She is a singer ,O bir şarkıcı. ,"[""He's a singer."", ""She's a singer.""]"
She is a solicitor.,वह एक वकील है। ,He is a lawyer. ,وہ ایک وکیل ہے۔ ,He is a lawyer. ,هي محامية. ,She is a lawyer. ,هغه یوه وکیله ده. ,She is a lawyer. ,O bir avukattır. ,"['He is a lawyer.', 'She is a lawyer.']"
She is a speech pathologist.,वह एक भाषण रोगविज्ञानी है। ,He is a speech pathologist. ,وہ اسپیچ پیتھالوجسٹ ہیں۔ ,He is a speech pathologist. ,هي أخصائية أمراض النطق. ,She is a speech pathologist. ,هغه د وینا رنځپوه ده. ,She is a speech pathologist. ,Konuşma patoloğu. ,Speech pathologist. 
She is a speech-language pathologist.,वह एक भाषण-भाषा रोग विशेषज्ञ हैं। ,He is a speech-language pathologist. ,وہ اسپیچ لینگویج ماہر نفسیات ہیں۔ ,She is a speech language psychologist. ,هي أخصائية أمراض النطق واللغة. ,She is a specialist in speech and language pathology. ,هغه د بیان ژبې رنځپوه ده. ,She is a rhetorician. ,Konuşma dili patoloğu. ,Speech language pathologist. 
She is a statistician.,वह एक सांख्यिकीविद् है। ,He is a statistician. ,وہ ایک شماریات دان ہے۔ ,He is a statistician. ,هي إحصائية. ,It is a statistic. ,هغه احصاییه ده ,He is a statistician ,O bir istatistikçi. ,"[""He's a statistician."", ""She's a statistician.""]"
She is a surveyor.,वह एक सर्वेक्षक है। ,He is a surveyor. ,وہ ایک سرویئر ہے۔ ,He is a surveyor. ,هي مساح. ,She is a surveyor. ,هغه یوه سروی ده. ,He is a surveyor. ,O bir eksper. ,"[""He's an expert."", ""She's an expert.""]"
She is a therapist.,वह एक चिकित्सक है। ,He is a doctor. ,وہ ایک معالج ہیں۔ ,He is a physician. ,هي معالجة. ,Are treated. ,هغه یو معالجه ده. ,She is a therapist. ,O bir terapist. ,"[""He's a therapist."", ""She's a therapist.""]"
